title|plot|type|year|runtime|genre|director|actors|country|rating
Dr. Oakley, Yukon Vet|Dr. Oakley is the only vet in her area of the Yukon. She treats domestic pets, endangered wildlife, farm animals--basically anything that walks on fours, crawls, flies. All of that- plus she's a wife and a mom of three girls.|movie|2014|N/A|Reality-TV|N/A|Michelle Oakley, Zac Fine|USA|8.1
Dr. T, Lone Star Vet|Dr. Lauren Thielen (Dr. T) is back home in Texas to open her very own exotic animal practice, located alongside one of the state's largest and busiest animal hospitals. With the support of ...|series|2019|N/A|Reality-TV|N/A|Chris Payne Gilbert, Lauren Thielen|USA|8.9
Dragon Around|Chip and Dale think they see a dragon coming toward their tree. It's really just Donald with a power shovel, clearing the way for a freeway, but he decides to play along, fitting a welding ...|movie|1954|7 min|Family, Comedy, Animation|Jack Hannah|Dessie Flynn, James MacDonald, Clarence Nash|USA|7.2
Drain Alcatraz|N/A|movie|2017|45 min|Documentary|Wayne Abbott|Clarence Anglin, John William Anglin, Bill Baker, Patrick Barnard|USA|5.4
Drain the Bermuda Triangle|N/A|movie|2014|44 min|Documentary|Jobim Sampson|Marvin W. Barrash, Eric Berkenpas, Simon Boxall, Thomas M. Iliffe|USA|6
Drain the Great Lakes|Scientists and film makers take us to the bottom of the Great Lakes and show us what the bottoms are like and go back in history when they formed.|series|2011|47 min|Documentary|Wayne Abbott, Crispin Sadler|Russell Boulter, Steve Blasco, Tom Farnquist, Russ Green|UK, Canada, USA|7.5
Drain the Ocean: WWII|World War II left the greatest-ever number of ships and submarines hidden beneath the waves. Now, as the oceans drain, each vessel reveals its secrets through new data-based 3D ...|movie|2016|44 min|History|Mike Slee|Russell Boulter, James Delgado, Herbert Weatherwax, Scott Pawlowski|USA|7.2
Drain the Oceans|By scanning the locations at the bottom of the ocean where sunken ships, treasures and even cities lie, the show tries to answer what they look like, how they got there and if they hide any secrets.|movie|2018|47 min|Documentary, History, Mystery|N/A|Craig Sechler, Russell Boulter, James Delgado, Eric Grove|UK, Australia|7.6
Drain the Sunken Pirate City|N/A|movie|2017|47 min|N/A|Sophie Elwin-Harris|Craig Sechler, Russell Boulter, Simon Brown, Peter Francis|UK|6.2
Drain the Titanic|Computer-generated imagery and other visualization techniques reveal how it would look if all the water was removed from RMS Titanic's final resting place.||2015|46 min|Documentary|Jobim Sampson|Russell Boulter, Brad Cartner, Kenneth Vrana, James P. Delgado|UK, Canada, USA|5.7
DuckTales|The globe-trotting treasure-hunting money-making adventures of billionaire Scrooge McDuck and his nephews.|series|1987|23 min|Animation, Adventure, Comedy, Family|N/A|Alan Young, Russi Taylor, Chuck McCann, Terence McGovern|USA|8.1
DuckTales|The comedy-adventure series chronicles the high-flying adventures of trillionaire Scrooge McDuck, his grandnephews - Huey, Dewey, and Louie - and temperamental nephew Donald Duck, Launchpad McQuack, Mrs. Beakley, and her granddaughter Webby.|movie|2017|21 min|Animation, Action, Adventure, Comedy, Family, Fantasy, Mystery, Sci-Fi|N/A|David Tennant, Ben Schwartz, Danny Pudi, Kate Micucci|USA|8.2
DuckTales the Movie: Treasure of the Lost Lamp|Scrooge McDuck takes Huey, Dewey, and Louie to Egypt to find a pyramid and magic lamp.|series|1990|74 min|Animation, Adventure, Comedy, Family, Fantasy|Bob Hathcock|Alan Young, Terence McGovern, Russi Taylor, Richard Libertini|France, USA|6.9
Dug's Special Mission|"Alpha, Beta, and Gamma try to keep Dug out of their way while they hunt for Kevin the Snipe. However, their instructions for his ""very special mission"" keep backfiring on them."|movie|2009|5 min|Animation, Short, Comedy, Family|Ronnie Del Carmen|Bob Peterson, Delroy Lindo, Jerome Ranft|USA|7
Dumbo|A young elephant, whose oversized ears enable him to fly, helps save a struggling circus, but when the circus plans a new venture, Dumbo and his friends discover dark secrets beneath its shiny veneer.|series|2019|112 min|Adventure, Family, Fantasy|Tim Burton|Colin Farrell, Michael Keaton, Danny DeVito, Eva Green|USA, UK, Australia, Canada|6.3
Earth Live|Jane Lynch and Phil Keoghan take viewers on a journey around the world, focusing on some of the most spectacular wildlife.|movie|2017|N/A|Documentary|Glenn Weiss|Jane Lynch, Phil Keoghan|USA|5.6
Easter Island Underworld|N/A||2009|120 min|Documentary|Geoffrey Luck|Peter Coyote|N/A|7.4
Eddie's Million Dollar Cook-Off|Eddie loves baseball. His dad's the coach, his best friends are his teammates. But will he strike out with them all if he trades his glove for an oven mitt.|movie|2003|110 min|Comedy, Family, Sport|Paul Hoen|Taylor Ball, Orlando Brown, Reiley McClendon, Mark L. Taylor|USA|6
Eight Below|Brutal cold forces two Antarctic explorers to leave their team of sled dogs behind as they fend for their survival.|movie|2006|120 min|Adventure, Drama, Family|Frank Marshall|Paul Walker, Bruce Greenwood, Moon Bloodgood, Wendy Crewson|USA|7.3
El Materdor|Mater tells Lightning McQueen about his former job as a famous bulldozer fighter in Spain.|movie|2008|36 min|Animation, Adventure, Comedy, Family|John Lasseter, Rob Gibbs(co-director), Victor Navone(co-director)|Keith Ferguson, Larry the Cable Guy|USA|6.4
Elena of Avalor|Princess Elena has saved her magical kingdom, Avalor, from an evil sorceress and must learn to rule as its crown princess. Elena's adventures will lead her to understand that her new role requires thoughtfulness, resilience and compassion.|movie|2016|24 min|Animation, Action, Adventure, Family, Fantasy, Musical|N/A|Aimee Carrero, Jillian Rose Reed, Joseph Haro, Jorge Diaz|USA|6.4
Elephant|Documentary follows an African elephant named Shani and her son Joao as their heard make an epic journey across the Kalashnikov Desert.|movie|2020|N/A|Documentary, Adventure, Biography, Family|Mark Linfield, Vanessa Berlowitz(co-director)|Meghan Markle|N/A|4.7
Elmer Elephant|The other children at a birthday party mock Elmer Elephant for his big nose, but it proves useful when he needs to save the birthday girl from a fire in her tree house.|movie|1936|9 min|Family, Animation, Short, Comedy|Wilfred Jackson|Pinto Colvig, Bernice Hansen, Clarence Nash|USA|7
Emil and the Detectives|Emil goes to Berlin to see his grandmother with a large amount of money and is offered sweets by a strange man that make him sleep. He wakes up at his stop with no money. It is up to him and a group of children to save the day.|movie|1964|99 min|Comedy, Family, Drama, Crime|Peter Tewksbury|Walter Slezak, Bryan Russell, Roger Mobley, Heinz Schubert|USA|6.2
Empire of Dreams: The Story of the 'Star Wars' Trilogy|An in-depth making of documentary about the original Star Wars trilogy, covering the productions of the three films and their impact on popular culture.|movie|2004|151 min|Documentary, History, Sci-Fi|Edith Becker, Kevin Burns|Robert Clotworthy, Walter Cronkite, George Lucas, Steven Spielberg|USA|8.3
Encore!|Executive producer Kristen Bell, who also appears, reunites the cast of a high school musical and asks them to perform it again years later. Each former student reprises their role from ...|movie|2019|N/A|Musical, Reality-TV|N/A|Kristen Bell, Matt Fowler, Adam Wachter|USA|7.2
Episode #2.7|A slew of unusual findings and emergencies have Dr. Pol and Diane convinced the full moon is the cause of the chaos.|movie|2013|N/A|Documentary|N/A|Jan Pol, Brenda Grettenberger, Charles Pol, Diane Pol|N/A|N/A
Escape to Witch Mountain|Two mysterious orphan children have extraordinary powers and are chased by a scheming millionaire. But where do these kids really call home?|movie|1975|97 min|Adventure, Family, Fantasy, Mystery, Sci-Fi|John Hough|Eddie Albert, Ray Milland, Donald Pleasence, Kim Richards|USA|6.4
Even Stevens|The misadventures of the Stevens family of five in Sacramento, California.|movie|2000|30 min|Comedy, Family|N/A|Shia LaBeouf, Christy Carlson Romano, Nick Spano, Tom Virtue|USA|7.6
Expedition Amelia|Deep-sea explorer Dr. Robert Ballard attempts to solve the mystery of Amelia Earhart's disappearance in an effort to end speculation about what actually happened to her.|movie|2019|N/A|N/A|N/A|Robert Ballard, Fredrik T. Hiebert|USA|6.9
Expedition Mars|Expedition Mars brings to life one of the greatest sagas of the Space Age, the epic adventures of Spirit and Opportunity, the rovers that saved NASA's Mars program after a string of failures in the 1990's.|movie|2016|88 min|Documentary|N/A|John Callas, Jake Matijevic, Steve Squyres|USA|8.1
Family Sundays|Amber Kemp Gerstel hosts a crafting show bringing families together through the wonderful world of Disney inspired DIYs.|series|2019|N/A|Family, Reality-TV|N/A|Amber Kemp Gerstel|USA|6.1
Fancy Nancy|The story of a young girl who loves to wear fancy clothes.|movie|2018|22 min|Animation, Short, Adventure, Family, Musical|N/A|Malachi Barton, Rachael MacFarlane, Blake Moore, Alyson Hannigan|USA, Canada|5.4
Fantasia|A collection of animated interpretations of great works of Western classical music.||1940|125 min|Animation, Family, Fantasy, Music|James Algar, Samuel Armstrong, Ford Beebe Jr., Norman Ferguson, David Hand, Jim Handley, T. Hee, Wilfred Jackson, Hamilton Luske, Bill Roberts, Paul Satterfield, Ben Sharpsteen|Deems Taylor, Leopold Stokowski, The Philadelphia Orchestra|USA|7.8
Fantasia 2000|An update of the original film with new interpretations of great works of classical music.|movie|1999|75 min|Animation, Comedy, Family, Fantasy, Music|James Algar, Gaëtan Brizzi, Paul Brizzi, Hendel Butoy, Francis Glebas, Eric Goldberg, Don Hahn, Pixote Hunt|Steve Martin, Itzhak Perlman, Quincy Jones, Bette Midler|USA|7.2
Fantastic Four: The Animated Series|The adventures of Marvel Comic's greatest superhero team.|movie|1994|22 min|Animation, Action, Sci-Fi|N/A|Beau Weaver, Lori Alan, Chuck McCann, Quinton Flynn|USA|6.4
Fantastic Four: World's Greatest Heroes|The adventures of the Marvel Universe's premiere superhero family.|movie|2006|30 min|Animation, Action, Family, Sci-Fi|N/A|Hiro Kanagawa, Lara Gilchrist, Christopher Jacot, Brian Dobson|USA|6.8
Fast Layne|"Twelve-year-old over-achiever Layne finds her orderly life thrown into a tailspin when she discovers a sophisticated talking car named ""V.I.N."" hidden in an abandoned shed."|series|2019|30 min|Comedy|N/A|Enid-Raye Adams, Sophie Pollono, Sofia Rosinsky, Brandon Rossel|USA|5.5
Ferdinand the Bull|Little Ferdinand the bull is stung by a bumblebee when men come to pick a bull for a fight. When he gets in the arena, all he cares about are the flowers in the matador's hands.|series|1938|8 min|Animation, Short, Comedy, Family|Dick Rickard|Don Wilson|USA|7.2
Finding Dory|Friendly but forgetful blue tang Dory begins a search for her long-lost parents, and everyone learns a few things about the real meaning of family along the way.|movie|2016|97 min|Animation, Adventure, Comedy, Family|Andrew Stanton, Angus MacLane(co-director)|Ellen DeGeneres, Albert Brooks, Ed O'Neill, Kaitlin Olson|USA|7.3
Finding Nemo|After his son is captured in the Great Barrier Reef and taken to Sydney, a timid clownfish sets out on a journey to bring him home.|movie|2003|100 min|Animation, Adventure, Comedy, Family|Andrew Stanton, Lee Unkrich(co-director)|Albert Brooks, Ellen DeGeneres, Alexander Gould, Willem Dafoe|USA, Australia|8.1
First Kid|A former boxer turned Secret Service agent is assigned to protect the President's son, who seems determined to make life difficult for his new protector.|movie|1996|101 min|Family, Comedy|David Mickey Evans|Sinbad, Brock Pierce, Blake Boyd, Timothy Busfield|USA|5.2
Fish Hooks|Three friends attend a school for fish submerged in a pet shop.|movie|2010|22 min|Animation, Adventure, Comedy, Family|N/A|Chelsea Kane, Justin Roiland, Kyle Massey|USA|4.6
Flight of the Navigator|In 1978, a boy travels 8 years into the future and has an adventure with an intelligent, wisecracking alien ship.|series|1986|90 min|Adventure, Comedy, Family, Sci-Fi|Randal Kleiser|Joey Cramer, Paul Reubens, Cliff De Young, Veronica Cartwright|USA|6.9
Float|A father discovers that his son floats, which makes him different from other kids. To keep them both safe from the judgment of the world, Dad hides, covers, and grounds him. But when his son's ability becomes public, Dad must decide whether to run and hide or to accept his son as he is.||2019|7 min|Animation, Short, Family, Fantasy|Bobby Rubio|Eli Fucile, Mika Kubo, Bobby Rubio, Luna Watson|USA|7.4
Flowers and Trees|An evil tree stump, jealous of two trees in love, starts a forest fire.|movie|1932|8 min|Animation, Short, Comedy|Burt Gillett|Esther Campbell, Marion Darlington|USA|7.5
Flubber|"An absent-minded professor discovers ""flubber,"" a rubber-like super-bouncy substance."|series|1997|93 min|Comedy, Family, Sci-Fi|Les Mayfield|Robin Williams, Marcia Gay Harden, Christopher McDonald, Ted Levine|USA|5.3
For the Birds|A group of snooty birds roosting on a telephone wire get their just deserts when a goofy bird drops in.|movie|2000|3 min|Animation, Short, Comedy, Family|Ralph Eggleston|Ralph Eggleston|USA|8
Frank and Ollie|A documentary about two famed Disney animators, Frank and Ollie.|movie|1995|89 min|Documentary|Theodore Thomas|Frank Thomas, Ollie Johnston, Sylvia Roemer, John Canemaker|USA|7.8
Frankenweenie|A young boy sets out to revive his dead pet using the monstrous power of science.|series|1984|29 min|Short, Comedy, Drama, Sci-Fi|Tim Burton|Shelley Duvall, Daniel Stern, Barret Oliver, Joseph Maher|USA|7.3
Frankenweenie|When a boy's beloved dog passes away suddenly, he attempts to bring the animal back to life through a powerful science experiment.|movie|2012|87 min|Animation, Comedy, Family, Horror, Sci-Fi|Tim Burton|Catherine O'Hara, Martin Short, Martin Landau, Charlie Tahan|USA|6.9
Freaky Friday|A mother and daughter find their personalities switched and have to live each other's lives on one strange Friday.|movie|1976|95 min|Comedy, Family, Fantasy|Gary Nelson|Barbara Harris, Jodie Foster, John Astin, Patsy Kelly|USA|6.3
Freaky Friday|An overworked mother and her daughter do not get along. When they switch bodies, each is forced to adapt to the other's life for one freaky Friday.|movie|2003|97 min|Comedy, Family, Fantasy, Music, Romance|Mark Waters|Jamie Lee Curtis, Lindsay Lohan, Mark Harmon, Harold Gould|USA|6.1
Freaky Friday|A musical about what happens when a mom and daughter argue, get their bodies magically switched, and have to make it through the day being the other at high school or preparing for the wedding next day - while hoping to switch back.|series|2018|90 min|Comedy, Fantasy, Musical|Steve Carr|Cozi Zuehlsdorff, Heidi Blickenstaff, Jason Maybaum, Alex Désert|USA|3.7
Free Solo|Alex Honnold attempts to become the first person to ever free solo climb El Capitan.|series|2018|100 min|Documentary, Adventure, Sport|Jimmy Chin, Elizabeth Chai Vasarhelyi|Alex Honnold, Tommy Caldwell, Jimmy Chin, Cheyne Lempe|USA|8.2
Frenemies|Three sets of friends deal with the ups and downs of their ever-changing relationships.|movie|2012|87 min|Comedy, Drama, Family|Daisy von Scherler Mayer|Bella Thorne, Zendaya, Mary Mouser, Nick Robinson|USA|5
Frozen|When the newly crowned Queen Elsa accidentally uses her power to turn things into ice to curse her home in infinite winter, her sister Anna teams up with a mountain man, his playful reindeer, and a snowman to change the weather condition.|series|2013|102 min|Animation, Adventure, Comedy, Family, Fantasy, Musical|Chris Buck, Jennifer Lee|Kristen Bell, Idina Menzel, Jonathan Groff, Josh Gad|USA|7.5
Frozen II|Anna, Elsa, Kristoff, Olaf and Sven leave Arendelle to travel to an ancient, autumn-bound forest of an enchanted land. They set out to find the origin of Elsa's powers in order to save their kingdom.|series|2019|103 min|Animation, Adventure, Comedy, Family, Fantasy, Musical|Chris Buck, Jennifer Lee|Kristen Bell, Idina Menzel, Josh Gad, Jonathan Groff|USA|7
Full-Court Miracle|An African American college basketball star becomes the head coach of a yeshiva's struggling basketball team in Philadelphia, Pennsylvania, after a knee injury forces him to leave the game. Based on the true story of Lamont Carr.|movie|2003|90 min|Drama, Family, Sport|Stuart Gillard|Alex D. Linz, Richard T. Jones, R.H. Thomson, Sean Marquette|USA|5.7
Fun and Fancy Free|"Jiminy Cricket hosts two Disney animated shorts: ""Bongo,"" about a circus bear escaping to the wild, and ""Mickey and the Beanstalk,"" a take on the famous fairy tale."|movie|1947|73 min|Animation, Adventure, Comedy, Family, Fantasy, Musical, Romance|Jack Kinney, Hamilton Luske, William Morgan, Bill Roberts|Edgar Bergen, Dinah Shore, Luana Patten, Anita Gordon|USA|6.6
Fuzzbucket|"In the vein of ""Harvey"", an invisible creature befriends a 12 year old boy. Of course, no one else can see him nor believes in him."||1986|46 min|Adventure, Comedy, Family|Mick Garris|Chris Hebert, Phil Fondacaro, Joe Regalbuto, Wendy Phillips|USA|7.6
Gargoyles|A clan of heroic night creatures pledge to protect modern New York City as they did in Scotland one thousand years earlier.|movie|1993|30 min|Animation, Action, Adventure, Comedy, Crime, Drama, Family, Fantasy, Mystery, Romance, Thriller|N/A|Keith David, Salli Richardson-Whitfield, Jeff Bennett, Frank Welker|USA|8.1
Geek Charming|To win a school popularity contest, a high school diva permits a film club classmate to record her popular life, but the film starts documenting her decline instead.|movie|2011|94 min|Comedy, Drama, Family, Romance|Jeffrey Hornaday|Sarah Hyland, Matt Prokop, Sasha Pieterse, Jordan Nichols|USA|6.4
Genius|Charlie Boyle finds that even his high IQ can't solve all of his problems when he takes on a double life in order to make friends his own age.|movie|1999|82 min|Comedy, Family, Romance, Sci-Fi|Rod Daniel|Trevor Morgan, Emmy Rossum, Charles Fleischer, Yannick Bisson|USA|6.3
George of the Jungle|A man raised in the jungle by apes falls in love with a wealthy American heiress.|movie|1997|92 min|Action, Adventure, Comedy, Family, Romance|Sam Weisman|Brendan Fraser, Leslie Mann, Thomas Haden Church, Richard Roundtree|USA|5.4
George of the Jungle 2|George, now a father, goes to Las Vegas, where he has to help out his brother.|episode|2003|87 min|Adventure, Comedy, Family|David Grossman|Christopher Showerman, Julie Benz, Angus T. Jones, Thomas Haden Church|USA, Australia|3.3
Geri's Game|Geri sets up a chess game to play his greatest opponent - himself.||1997|4 min|Animation, Short, Family|Jan Pinkava|Bob Peterson|USA|7.9
Get a Clue|A wealthy student with too much fashion sense, her equally rich friends, and her rival/superior from the school paper work together to solve the case when their teacher goes missing.|movie|2002|83 min|Comedy, Crime, Family, Mystery|Maggie Greenwald|Lindsay Lohan, Bug Hall, Ian Gomez, Brenda Song|USA|5.1
G-Force|A specially trained squad of guinea pigs is dispatched to stop a diabolical billionaire from taking over the world.|movie|2009|88 min|Action, Adventure, Comedy, Family, Fantasy, Sci-Fi|Hoyt Yeatman|Bill Nighy, Will Arnett, Zach Galifianakis, Kelli Garner|USA|5.1
Girl Meets World|More than a decade after Boy Meets World (1993), Cory and Topanga Matthews are married and have two children. Their daughter, Riley, faces life lessons through her family, friends, and school--where her father is her history teacher--as her parents did when they were younger.|movie|2014|23 min|Comedy, Drama, Family|N/A|Rowan Blanchard, Ben Savage, Sabrina Carpenter, Peyton Meyer|USA|7.2
Girl Vs. Monster|A teen girl goes on a mission to recapture a dangerous monster that she accidentally released before it can do harm to her parents.|movie|2012|89 min|Action, Adventure, Comedy, Family, Fantasy, Sci-Fi|Stuart Gillard|Olivia Holt, Kerris Dorsey, Brendan Meyer, Katherine McNamara|USA, Canada|5.5
Glory Road|In 1966, Texas Western coach Don Haskins led the first all-black starting line-up for a college basketball team to the NCAA national championship.|series|2006|118 min|Biography, Drama, Sport|James Gartner|Josh Lucas, Derek Luke, Austin Nichols, Jon Voight|USA|7.2
Go Figure|A teenager dreams of becoming a champion ice-skater, and soon discovers a top Russian instructor is working at a nearby private school.|movie|2005|88 min|Comedy, Drama, Family, Sport|Francine McDougall|Jordan Danger, Whitney Sloan, Cristine Rose, Ryan Malgarini|USA|5.7
Going to the Mat|Jace Newfield has a problem. Besides being blind and being the new kid at school, his problem is that the kids at his new school thinks he's a jerk. Jace has to find a way to be accepted ...|series|2004|120 min|Drama, Family, Sport|Stuart Gillard|Andrew Lawrence, Khleo Thomas, Alessandra Torresani, Wayne Brady|USA|6.8
Good Luck Charlie|The Duncan family are adjusting to the surprise birth of their fourth child, Charlie. When parents Amy and Bob return to work they put their latest addition in the care of her three older siblings.|movie|2010|22 min|Comedy, Drama, Family|N/A|Bridgit Mendler, Leigh-Allyn Baker, Bradley Steven Perry, Mia Talerico|USA|7
Good Luck Charlie, It's Christmas!|Idiocy strikes when a woman and her daughter get separated from their family during the holidays.|episode|2011|90 min|Comedy, Drama, Family|Arlene Sanford|Bridgit Mendler, Leigh-Allyn Baker, Bradley Steven Perry, Mia Talerico|USA|6.4
Goof Troop|The classic Disney character Goofy is a single father raising his son, Max, in Spoonerville. Pete, a frequent antagonist from the old cartoons, lives next door with his family.|movie|1992|30 min|Animation, Adventure, Comedy, Family, Music|N/A|Rob Paulsen, April Winchell, Jim Cummings, Bill Farmer|USA|6.8
Gordon Ramsay: Uncharted|"Globetrotting celebrity chef Gordon Ramsay serves up an epic adventure in ""Gordon Ramsay: Uncharted."" He travels around the world meeting with indigenous people to learn about their foods ..."|movie|2019|60 min|Adventure, Reality-TV|N/A|Gordon Ramsay|N/A|7.9
Gotta Kick It Up!|A school dance team get a new lease of life thanks to a teacher who lets them in on the secret of Latin rhythms for a big competition.|movie|2002|78 min|Comedy, Drama, Family|Ramón Menéndez|Camille Guaty, America Ferrera, Jhoanna Flores, Suilma Rodriguez|USA|5.8
Gravity Falls|Twin siblings Dipper and Mabel Pines spend the summer at their great-uncle's tourist trap in the enigmatic Gravity Falls, Oregon.|movie|2012|23 min|Animation, Action, Adventure, Comedy, Family, Fantasy, Mystery, Sci-Fi|N/A|Jason Ritter, Alex Hirsch, Kristen Schaal, Linda Cardellini|USA|8.9
Great Migrations|Great Migrations takes viewers on the epic journeys animals undertake to ensure the survival of their species.|movie|2010|45 min|Documentary|N/A|Tarkan, Alec Baldwin, Stephen Fry|USA|8.1
Greyfriars Bobby: The True Story of a Dog|The remarkable veritable story of a terrier named Bobby and the enduring friendship he forges with a tenderhearted shepherd known simply as Old Jock---unbroken even by the kindly old man's death.|episode|1961|87 min|Drama, Family|Don Chaffey|Donald Crisp, Laurence Naismith, Alex Mackenzie, Duncan Macrae|USA|7.3
Guardians of the Galaxy|A group of intergalactic criminals must pull together to stop a fanatical warrior with plans to purge the universe.|movie|2014|121 min|Action, Adventure, Comedy, Sci-Fi|James Gunn|Chris Pratt, Zoe Saldana, Dave Bautista, Vin Diesel|USA|8
Guardians of the Galaxy|The adventures of a band of space warriors who work to protect the universe from the evil overlord Thanos.|movie|2015|22 min|Animation, Action, Adventure, Comedy, Drama, Family, Sci-Fi|N/A|Kevin Michael Richardson, Vanessa Marshall, David Sobolov, Will Friedle|USA|7.4
Guardians of the Galaxy Vol. 2|The Guardians struggle to keep together as a team while dealing with their personal family issues, notably Star-Lord's encounter with his father the ambitious celestial being Ego.|movie|2017|136 min|Action, Adventure, Comedy, Sci-Fi|James Gunn|Chris Pratt, Zoe Saldana, Dave Bautista, Vin Diesel|USA|7.6
Gus|The California Atoms are in last place with no hope of moving up. But by switching the mule from team mascot to team member, (He can kick 100 yard field goals!) they start winning, and move...|movie|1976|96 min|Comedy, Family, Sport|Vincent McEveety|Edward Asner, Don Knotts, Gary Grimes, Tim Conway|USA|5.9
Hacksaw|A girl captures a white stallion to compete in a contest.|movie|1971|89 min|Family|Larry Lansburgh|Tab Hunter, Victor Millan, Ray Teal, Russ McCubbin|USA|6.2
Halloweentown|After learning she is a witch, a girl helps save a town full of other supernatural creatures.|movie|1998|84 min|Adventure, Comedy, Family, Fantasy|Duwayne Dunham|Debbie Reynolds, Kimberly J. Brown, Judith Hoag, Joey Zimmerman|USA|6.8
Halloweentown High|A girl in a magical world bets her family's magic that nothing bad will happen when kids from Halloweentown attend high school in the mortal realm.||2004|82 min|Comedy, Family, Fantasy|Mark A.Z. Dippé|Kimberly J. Brown, Debbie Reynolds, Judith Hoag, Joey Zimmerman|USA|6.2
Halloweentown II: Kalabar's Revenge|"The Cromwell clan split their time between the real world and ""Halloweentown"", but the son of an old rival threatens to make the latter ""real"" and the real world a place of monsters."|movie|2001|81 min|Adventure, Family, Fantasy|Mary Lambert|Kimberly J. Brown, Judith Hoag, Daniel Kountz, Joey Zimmerman|USA|6.5
Handy Manny|A show about handyman Manny Garcia and his helpful talking tools, who make repairs and fix problems in the small town of Sheetrock Hills.|movie|2006|24 min|Animation, Family|N/A|Wilmer Valderrama, Dee Bradley Baker, Nancy Truman, Carlos Alazraqui|USA, Canada|5.6
