title|plot|type|year|runtime|genre|director|actors|country|rating
Mr. Boogedy|A novelty-salesman moves his family into a new house. Initially dismissing incidents as more of their father's practical jokes, the family soon learns that the house is haunted by people who lived in the house 300 years previously.||1986|46 min|Adventure, Drama, Family|Oz Scott|Richard Masur, Mimi Kennedy, Benji Gregory, David Faustino|USA|7.3
Mr. Duck Steps Out|Donald is headed for Daisy. However, his nephews are too.|movie|1940|8 min|Animation, Short, Comedy|Jack King|Clarence Nash|USA|7.5
Mr. Mouse Takes a Trip|Mickey is heading out on vacation from Burbank to Pomona, taking the train. The conductor, Pete, won't let him on with Pluto, so he hides Pluto in his suitcase, and tries to hide him all ...|movie|1940|8 min|Family, Animation, Comedy|Clyde Geronimi|Billy Bletcher, Walt Disney, Lee Millar|USA|7.2
Mulan|To save her father from death in the army, a young maiden secretly goes in his place and becomes one of China's greatest heroines in the process.||1998|88 min|Animation, Adventure, Family, Fantasy, Musical, War|Tony Bancroft, Barry Cook|Miguel Ferrer, Harvey Fierstein, Freda Foh Shen, June Foray|USA|7.6
Mulan II|While preparing for their wedding, Shang and Mulan are suddenly sent off on a secret mission. Mushu starts to meddle, and a surprise attack by Mongolians doesn't help either.|movie|2004|79 min|Animation, Action, Comedy, Family, Musical|Darrell Rooney, Lynne Southerland|Ming-Na Wen, BD Wong, Mark Moseley, Lucy Liu|USA, South Korea, Singapore, Russia, Malaysia, Kazakhstan, Taiwan, Hong Kong, Japan, China, India, Syria, Iran, Egypt, Pakistan|5.7
Muppet Babies|Baby versions of Jim Henson's famous Muppet characters go on wacky adventures through their imaginations|movie|2018|23 min|Animation, Short, Adventure, Comedy, Family, Fantasy, Musical|N/A|Dee Bradley Baker, Eric Bauza, Matt Danner, Jessica DiCicco|South Korea, USA, China, Japan|7
Muppet Moments|N/A||2015|N/A|Short, Family|N/A|Bill Barretta, Dave Goelz, Eric Jacobson, Steve Whitmire|USA|8.8
Muppet Treasure Island|The Muppets' twist on the classic tale.|series|1996|99 min|Action, Adventure, Comedy, Family, Musical, Romance|Brian Henson, David Lane|Tim Curry, Billy Connolly, Jennifer Saunders, Kevin Bishop|USA|7
Muppets Most Wanted|While on a grand world tour, The Muppets find themselves wrapped into an European jewel-heist caper headed by a Kermit the Frog look-alike and his dastardly sidekick.|movie|2014|107 min|Adventure, Comedy, Crime, Family, Musical, Mystery|James Bobin|Ricky Gervais, Ty Burrell, Tina Fey, Steve Whitmire|USA|6.4
My Dog, the Thief: Part 1|An air-traffic reporter discovers that his partner--a St. Bernard dog--has accidentally swiped a priceless necklace from a jewel-smuggling gang.|movie|1969|88 min|Adventure, Biography, Drama, Family, Western|Robert Stevenson|Dwayne Hickman, Mary Ann Mobley, Elsa Lanchester, Joe Flynn|USA|6.6
My Favorite Martian|A Martian lands on Earth and makes friends with a reporter.|movie|1999|94 min|Comedy, Family, Sci-Fi|Donald Petrie|Christopher Lloyd, Jeff Daniels, Elizabeth Hurley, Daryl Hannah|USA|5.1
My Friends Tigger & Pooh|A girl and her dog have adventures with tigger and pooh in the hundred acre woods|series|2007|30 min|Animation, Short, Adventure, Family|N/A|Angelica Bolognesi Bonacini, Kimberlea Berg, Jim Cummings, Chloë Grace Moretz|USA|5.7
National Treasure|A historian races to find the legendary Templar Treasure before a team of mercenaries.|movie|2004|131 min|Action, Adventure, Mystery, Thriller|Jon Turteltaub|Nicolas Cage, Diane Kruger, Justin Bartha, Sean Bean|USA|6.8
National Treasure: Book of Secrets|Benjamin Gates must follow a clue left in John Wilkes Booth's diary to prove his ancestor's innocence in the assassination of Abraham Lincoln.|movie|2007|124 min|Action, Adventure, Family, Mystery, Thriller|Jon Turteltaub|Nicolas Cage, Justin Bartha, Diane Kruger, Jon Voight|USA|6.5
Nature Untamed|N/A|movie|2008|N/A|Documentary|N/A|Salvatore Vecchio|USA|N/A
Nature's Half Acre|The variety of wildlife in a meadow - particularly insects and flowers - is observed over the course of a year, through the use of microphotography and time-lapse photography.|movie|1951|33 min|Documentary, Short, Family|James Algar|Winston Hibler|USA|7.7
Newsies|A musical based on the New York City newsboy strike of 1899. When young newspaper sellers are exploited beyond reason by their bosses they set out to enact change and are met by the ruthlessness of big business.|movie|1992|121 min|Drama, Family, History, Musical|Kenny Ortega|Christian Bale, David Moscow, Luke Edwards, Max Casella|USA|7
Noelle|Santa's daughter must take over the family business when her father retires and her brother, who is supposed to inherit the Santa role, gets cold feet.|movie|2019|100 min|Comedy, Family, Fantasy|Marc Lawrence|Anna Kendrick, Shirley MacLaine, Bill Hader, Kingsley Ben-Adir|USA|6.2
Now You See It...|A budding producer searches for the country's best young magician.|series|2005|83 min|Drama, Family, Fantasy, Mystery|Duwayne Dunham|Aly Michalka, Johnny Pacar, Frank Langella, Chris Olivero|USA|6.3
Olaf's Frozen Adventure|"A Christmas-themed special featuring characters from Walt Disney Pictures' 53rd full-length animated motion picture, ""Frozen (2013)""."|movie|2017|22 min|Animation, Short, Adventure, Comedy, Family, Fantasy, Musical|Kevin Deters, Stevie Wermers|Josh Gad, Idina Menzel, Kristen Bell, Jonathan Groff|USA|5.5
Old Dogs|Two friends and business partners find their lives turned upside down when strange circumstances lead them to be the temporary guardians of seven year-old twins.|series|2009|88 min|Comedy, Family|Walt Becker|John Travolta, Robin Williams, Kelly Preston, Conner Rayburn|USA|5.4
Old Yeller|A teenage boy grows to love a stray yellow dog while helping his mother and younger brother run their Texas homestead while their father is away on a cattle drive. First thought to be good-for-nothing mutt, Old Yeller is soon beloved by all.|movie|1957|83 min|Adventure, Drama, Family, Western|Robert Stevenson|Dorothy McGuire, Fess Parker, Jeff York, Chuck Connors|USA|7.3
Oliver & Company|A lost and alone kitten joins a gang of dogs engaged in petty larceny in New York City.||1988|74 min|Animation, Adventure, Comedy, Family, Musical|George Scribner|Joey Lawrence, Billy Joel, Cheech Marin, Richard Mulligan|USA|6.7
On Ice|Mickey shows off his ice-skating skills to Minnie; Goofy does some unconventional ice fishing; Donald straps skates to Pluto and laughs at his attempts to skate. Donald gets strapped to a ...|movie|1935|8 min|Family, Comedy, Animation, Short|Ben Sharpsteen|Pinto Colvig, Walt Disney, Marcellite Garner, Clarence Nash|USA|7.5
Once Upon a Mattress|"In this hilarious tweaking of the fairy tale, ""The Princess and the Pea"", Queen Aggravain has ruled that none may marry until her son, Prince Dauntless marries. However, she has managed to ..."|series|2005|90 min|Comedy, Musical, Romance|Kathleen Marshall|Carol Burnett, Tracey Ullman, Denis O'Hare, Zooey Deschanel|USA|6.4
One Day at Disney|A 52-part shorts series that each focus on a different Walt Disney employee's job.|movie|2019|5 min|Documentary|N/A|Sterling K. Brown|USA|7.3
One Hundred and One Dalmatians|When a litter of Dalmatian puppies are abducted by the minions of Cruella de Vil, the parents must find them before she uses them for a diabolical fashion statement.|episode|1961|79 min|Animation, Adventure, Comedy, Family|Clyde Geronimi, Hamilton Luske, Wolfgang Reitherman|Rod Taylor, J. Pat O'Malley, Betty Lou Gerson, Martha Wentworth|USA|7.2
One Magic Christmas|An angel must show a mother the true meaning of Christmas. It's not just presents and materialistic things, but the people she cares about.|series|1985|89 min|Family, Fantasy|Phillip Borsos|Mary Steenburgen, Gary Basaraba, Harry Dean Stanton, Arthur Hill|Canada, USA|6.6
One Man Band|Two buskers engage in a petty feud over a child's donation.|movie|2005|4 min|Animation, Short, Comedy, Family, Music|Mark Andrews, Andrew Jimenez|N/A|USA|7.7
One Strange Rock|The extraordinary story of Earth and why it is special and uniquely brimming with life among a largely unknown but harsh cosmic arena; astronauts tell the story of Earth through unique perspective.|movie|2018|47 min|Documentary|N/A|Will Smith, Chris Hadfield, Jerry Linenger, Mae C. Jemison|USA|8.8
Onward|Two elven brothers embark on a quest to bring their father back for one day.|movie|2020|102 min|Animation, Adventure, Comedy, Family, Fantasy|Dan Scanlon|Tom Holland, Chris Pratt, Julia Louis-Dreyfus, Octavia Spencer|USA|7.5
Operation Dumbo Drop|To keep the loyalty of a village during the Vietnam war, a U.S. Army officer and his unit struggle to deliver it a live elephant.||1995|107 min|Action, Adventure, Comedy, Drama, Family, War|Simon Wincer|Danny Glover, Ray Liotta, Denis Leary, Doug E. Doug|USA|5.1
Origins: The Journey of Humankind|Our primal curiosity has sparked new inventions and revealed the mysteries of the universe. This eight part mini series strives to trace the pivotal innovations that make us modern.|movie|2017|60 min|Documentary|N/A|Jason Silva, Mark Monroe|USA|6.9
Out of Scale|Donald Duck has a model train and town laid out in his yard. He decides to move a live tree that doesn't match the model scale, not realizing it is home to chipmunks Chip and Dale. They in turn move into one of the miniature houses.|series|1951|7 min|Animation, Short, Comedy, Family|Jack Hannah|Dessie Flynn, James MacDonald, Clarence Nash|USA|7.6
Out of the Box|A group of kids and their two caregivers have built a cool clubhouse out of giant boxes. That's where they meet for music, play and special activities that kids can do at home.|series|1998|24 min|Comedy, Family|N/A|Tony James, Vivian Bayubay, Celine Ordioni|USA|7.5
Out There with Jack Randall|Zoologist Jack Randall journeys into Australia's Outback to encounter extraordinary wildlife.|movie|2019|N/A|Documentary|N/A|Jack Randall, Jack Randall|N/A|6.6
Paris to Pittsburgh|Paris to Pittsburgh brings to life the impassioned efforts of individuals who are battling the most severe threats of climate change in their own backyards. Set against the national debate ...|movie|2018|N/A|N/A|Sidney Beaumont, Michael Bonfiglio|Rachel Brosnahan|USA|5.9
Partly Cloudy|"Babies both human and animal are created up in the stratosphere, by the clouds themselves. One cloud specializes in ""dangerous"" babies, creating a challenge for his loyal stork that has to deliver them."|series|2009|6 min|Animation, Short, Comedy, Family, Fantasy|Peter Sohn|Tony Fucile, Lori Richardson|USA|8.2
Party Central|With a little trickery, Mike and Sulley help their social outcast friends at Monsters University have the best frat party ever.|series|2014|5 min|Animation, Short, Adventure, Comedy, Family, Fantasy|Kelsey Mann|Lori Alan, Carlos Alazraqui, Billy Crystal, Charlie Day|USA|7.1
Penguins|A coming-of-age story about an Adélie penguin named Steve who joins millions of fellow males in the icy Antarctic spring on a quest to build a suitable nest, find a life partner and start a family.|movie|2019|76 min|Documentary, Family|Alastair Fothergill, Jeff Wilson|Ed Helms|USA|6.9
Penguins: Life on the Edge|Follows the witty and tenacious team of filmmakers behind Disneynature's Penguins (2019), a coming-of-age story about an Adélie penguin named Steve.|series|2020|78 min|Documentary, Family|Alastair Fothergill, Jeff Wilson|Blair Underwood, Matthew Aeberhard, Julie Moniere, Daniel Rasmussen|USA|6.7
Perri|True-Life nature photography is used to tell the tale of a female tree squirrel named Perri who encounters many different forest creatures, both friendly and dangerous, as she grows up through the four seasons and finds a mate named Porro.||1957|75 min|Adventure, Family, Fantasy, Romance|Paul Kenworthy, Ralph Wright|Winston Hibler|USA|7.2
Peter Pan|Wendy and her brothers are whisked away to the magical world of Neverland with the hero of their stories, Peter Pan.|movie|1953|77 min|Animation, Adventure, Family, Fantasy, Musical|Clyde Geronimi, Wilfred Jackson, Hamilton Luske, Jack Kinney|Bobby Driscoll, Kathryn Beaumont, Hans Conried, Bill Thompson|USA|7.3
Peter Pan 2: Return to Never Land|In London during World War II, this is the story of Wendy's daughter, Jane, who is kidnapped by Captain Hook and Peter Pan must come to the rescue.|movie|2002|72 min|Animation, Adventure, Family, Fantasy|Robin Budd, Donovan Cook(co-director)|Harriet Owen, Blayne Weaver, Corey Burton, Jeff Bennett|USA, Canada, Australia|5.8
Pete's Dragon|An orphan boy and his magical dragon come to town with his abusive adoptive parents in pursuit.|movie|1977|128 min|Animation, Adventure, Comedy, Family, Fantasy, Musical|Don Chaffey, Don Bluth|Helen Reddy, Jim Dale, Mickey Rooney, Red Buttons|USA|6.4
Pete's Dragon|The adventures of an orphaned boy named Pete and his best friend Elliott, who happens to be a dragon.|movie|2016|102 min|Action, Adventure, Comedy, Drama, Family, Fantasy|David Lowery|Bryce Dallas Howard, Robert Redford, Oakes Fegley, Oona Laurence|USA|6.7
Phantom of the Megaplex|A young man working at a cinema on a special premiere night, finds that the films being shown are full of strange and eerie occurrences.|series|2000|89 min|Action, Comedy, Family, Mystery|Blair Treu|Taylor Handley, Corinne Bohrer, Caitlin Wachs, Jacob Smith|USA, Canada|6.5
Phil of the Future|A family from 2121 is stuck in 2004, trying desperately to fit in.|series|2004|25 min|Adventure, Comedy, Family, Sci-Fi|N/A|Raviv Ullman, Amy Bruckner, Craig Anton, Lise Simms|USA|7
Phineas and Ferb|Phineas and Ferb invent, scheme, and stay one step ahead of their bratty sister. Meanwhile, their pet platypus plots against evil Dr. Doofenshmirtz.|movie|2007|15 min|Animation, Action, Comedy, Family, Musical, Sci-Fi|N/A|Vincent Martella, Ashley Tisdale, Thomas Brodie-Sangster, Dan Povenmire|USA|7.9
Phineas and Ferb the Movie: Across the 2nd Dimension|Phineas and Ferb discover that Perry is a secret agent, and they all get stuck in an alternate dimension where Doofenschmirtz is the ruler of the tri-state area.|movie|2011|78 min|Animation, Action, Adventure, Comedy, Family, Musical, Sci-Fi|Robert Hughes, Dan Povenmire, Jay Lender, Jeff 'Swampy' Marsh, Kyle Menke|Vincent Martella, Ashley Tisdale, Thomas Brodie-Sangster, Caroline Rhea|USA|7.4
Phineas and Ferb: Mission Marvel|When Dr. Doofenshmirtz's latest invention causes the Marvel heroes to lose their powers, they team up with Phineas and Ferb to save the world from Doofenshmirtz and the Marvel villains.|movie|2013|45 min|Animation, Action, Comedy, Family, Musical, Sci-Fi|Robert Hughes, Sue Perrotto|Vincent Martella, Ashley Tisdale, Thomas Brodie-Sangster, Caroline Rhea|N/A|8.3
Phineas and Ferb: Star Wars|Phineas and Ferb travel to a galaxy far far away to help out some rebel heroes.|movie|2014|51 min|Animation, Action, Comedy, Family, Musical, Sci-Fi|Robert Hughes, Sue Perrotto|Vincent Martella, Ella Kennedy, Ashley Tisdale, Thomas Brodie-Sangster|USA|8.2
Pick of the Litter|Ups and downs of an adorable group of six dogs on their fascinating and surprisingly suspenseful quest to become guides for Guide Dogs for the Blind, the ultimate canine career.|movie|2019|N/A|Documentary|N/A|N/A|USA|N/A
Piglet's Big Movie|When Piglet comes up missing his Hundred Acre Wood friends use Piglet's own Book of Memories to find him, discovering along the way just how big a role he's played in their lives.||2003|75 min|Animation, Adventure, Comedy, Family, Musical, Mystery|Francis Glebas|John Fiedler, Jim Cummings, Andre Stojka, Kath Soucie|USA|6.1
Pinocchio|A living puppet, with the help of a cricket as his conscience, must prove himself worthy to become a real boy.|movie|1940|88 min|Animation, Comedy, Family, Fantasy, Musical|Norman Ferguson, T. Hee, Wilfred Jackson, Jack Kinney, Hamilton Luske, Bill Roberts, Ben Sharpsteen|Mel Blanc, Don Brodie, Stuart Buchanan, Walter Catlett|USA|7.4
Piper|A mother bird tries to teach her little one how to find food by herself. In the process, she encounters a traumatic experience that she must overcome in order to survive.|series|2016|6 min|Animation, Short, Family|Alan Barillaro|N/A|USA|8.4
Pirates of the Caribbean: At World's End|Captain Barbossa, Will Turner and Elizabeth Swann must sail off the edge of the map, navigate treachery and betrayal, find Jack Sparrow, and make their final alliances for one last decisive battle.||2007|169 min|Action, Adventure, Fantasy|Gore Verbinski|Johnny Depp, Geoffrey Rush, Orlando Bloom, Keira Knightley|USA|7.1
Pirates of the Caribbean: Dead Man's Chest|Jack Sparrow races to recover the heart of Davy Jones to avoid enslaving his soul to Jones' service, as other friends and foes seek the heart for their own agenda as well.|movie|2006|151 min|Action, Adventure, Fantasy|Gore Verbinski|Johnny Depp, Orlando Bloom, Keira Knightley, Jack Davenport|USA|7.3
Pirates of the Caribbean: On Stranger Tides|Jack Sparrow and Barbossa embark on a quest to find the elusive fountain of youth, only to discover that Blackbeard and his daughter are after it too.|movie|2011|136 min|Action, Adventure, Fantasy|Rob Marshall|Johnny Depp, Penélope Cruz, Geoffrey Rush, Ian McShane|USA, UK|6.6
Pirates of the Caribbean: The Curse of the Black Pearl|"Blacksmith Will Turner teams up with eccentric pirate ""Captain"" Jack Sparrow to save his love, the governor's daughter, from Jack's former pirate allies, who are now undead."|movie|2003|143 min|Action, Adventure, Fantasy|Gore Verbinski|Johnny Depp, Geoffrey Rush, Orlando Bloom, Keira Knightley|USA|8
Pixar in Real Life|This live action series brings iconic characters and moments from Pixar films into the real world. Filmed on location in and around New York City, the series surprises and delights real people in real locations when they least expect it.|series|2019|N/A|Comedy, Family, Reality-TV|N/A|Zihan Zhao|USA|6.7
Pixel Perfect|A teen uses a holograph to create a pop star for his friend's band.||2004|85 min|Family, Sci-Fi, Comedy, Fantasy, Music|Mark A.Z. Dippé|Raviv Ullman, Leah Pipes, Spencer Redford, Chad 'Chato' Alger|USA|5.7
PJ Masks|Three children become superheroes at night. During the school day a problem arises, and during the night the culprit is found by the PJ Masks and the problem gets solved by sharing ideas, ...|movie|2015|24 min|Animation, Action, Adventure, Family, Fantasy, Sci-Fi|N/A|Kyle Breitkopf, Addison Holley, Juan Luis Bonilla, Brianna Daguanno|France, UK|5.7
Playdate with Destiny|Maggie and Marge are having a play-date at Springfield's finest toddler play park when Maggie becomes smitten with a little boy. It's love at first suck and Maggie dreams about seeing him again after a day full of make-believe romance.|episode|2020|5 min|Animation, Short, Comedy, Family, Romance|David Silverman|Chris Edgerly|USA|6.7
Pluto's Christmas Tree|Mickey and Pluto pick out a tree for Christmas and bring it back home, completely unaware that Chip and Dale are already living in it.||1952|7 min|Animation, Short, Comedy, Family, Fantasy|Jack Hannah|Ruth Clifford, Pinto Colvig, Dessie Flynn, James MacDonald|USA|7.7
Pluto's Party|"It's Pluto's birthday party, but Mickey's dozen or so nephews seem to be having all the fun. Their present is a wagon so Pluto can pull them; the ""Pin the Tail on Pluto"" game doesn't go ..."|series|1952|7 min|Animation, Short, Comedy, Family|Milt Schaffer|Pinto Colvig, James MacDonald|USA|6.5
Pluto's Purchase|Mickey sends Pluto to the butcher store. Butch sees this and contrives to take Pluto's sausage, ultimately using some of his fleas to distract Pluto long enough. Pluto manages to retrieve ...|movie|1948|7 min|Animation, Comedy, Family|Charles A. Nichols|Pinto Colvig, James MacDonald|USA|6.6
Pocahontas|An English soldier and the daughter of an Algonquin chief share a romance when English colonists invade seventeenth century Virginia.|movie|1995|81 min|Animation, Adventure, Drama, Family, Musical, Romance|Mike Gabriel, Eric Goldberg|Joe Baker, Christian Bale, Irene Bedard, Billy Connolly|USA|6.7
Pocahontas II: Journey to a New World|Pocahontas sets off on a journey to England with Meeko, Flit, and Percy. Hearing rumors of John Smith's death, Pocahontas tries to prevent war and battle.||1998|72 min|Animation, Adventure, Drama, Family, Musical, Romance|Tom Ellery, Bradley Raymond|Irene Bedard, Jim Cummings, Donal Gibson, Finola Hughes|USA|4.9
Pollyanna|A young girl comes to an embittered town and confronts its attitude with her determination to see the best in life.||1960|134 min|Comedy, Drama, Family|David Swift|Hayley Mills, Jane Wyman, Richard Egan, Karl Malden|USA|7.4
Pooh's Grand Adventure: The Search for Christopher Robin|"Winnie the Pooh and company embark on a quest to rescue Christopher Robin from certain doom in a place called ""Skull"" after misreading a note he left for them."|movie|1997|76 min|Animation, Adventure, Comedy, Family, Musical|Karl Geurs|Jim Cummings, John Fiedler, Ken Sansom, Andre Stojka|USA|7.1
Pooh's Heffalump Movie|A Heffalump is heard trumpeting in the hundred acre woods. Winnie the Pooh, Tigger, and Piglet are scared and rush to Rabbit's house for advice. Roo joins them and they all agree that ...||2005|68 min|Animation, Comedy, Family, Fantasy, Musical, Mystery|Frank Nissen|Jim Cummings, John Fiedler, Nikita Hopkins, Kath Soucie|USA|6.4
Presto|A stage magician's rabbit gets into a magical onstage brawl against his neglectful guardian with two magic hats.|movie|2008|5 min|Animation, Short, Comedy, Family, Fantasy|Doug Sweetland|Doug Sweetland|USA|8.4
Primal Survivor|Primal Survivor tracks wilderness guide and survival instructor Hazen Audel as he tackles some of mankind's most rigorous journeys, relying on skills learned from native inhabitants.After ...|series|2016|N/A|Documentary|N/A|Hazen Audel|USA|8.5
Princess Protection Program|A princess whose country has been invaded goes into hiding in Louisiana, where she has to learn to act like an ordinary teenager.|series|2009|90 min|Comedy, Drama, Family|Allison Liddi-Brown|Demi Lovato, Selena Gomez, Nicholas Braun, Molly Hagan|USA|5.6
Prom|A group of teenagers get ready for their high school prom.|movie|2011|104 min|Comedy, Drama, Family, Romance|Joe Nussbaum|Aimee Teegarden, Thomas McDonell, DeVaughn Nixon, Danielle Campbell|USA|5.4
Prowlers of the Everglades|N/A||1953|32 min|Documentary, Short, Family|James Algar|Winston Hibler|USA|8.1
Puppy Dog Pals|Fun-loving pug puppies, brothers Bingo and Rolly, have thrill-seeking appetites that take them on exhilarating adventures in their neighborhood and around the globe.|movie|2017|24 min|Animation, Family|N/A|Issac Ryan Brown, Sam Lavagnino, Harland Williams, Jessica DiCicco|USA|7.1
Purl|An earnest ball of yarn named Purl gets a job at a fast-paced, high energy, male-centric start-up. Things start to unravel as she tries to fit in with this close-knit group. Purl must ask ...|series|2018|8 min|Animation, Short, Comedy, Family|Kristen Lester|Bret 'Brook' Parker, Michael Daley, Michael Frederickson, Erik Langley|USA|6.4
Quack Pack|The misadventures of Donald Duck and his rebellious teenage nephews with attitude, Huey, Dewey, and Louie.|movie|1993|30 min|Animation, Short, Adventure, Comedy, Family|N/A|Tony Anselmo, Jeannie Elias, Elizabeth Daily, Pamela Adlon|USA|6.8
Queen of Katwe|A Ugandan girl sees her world rapidly change after being introduced to the game of chess.|movie|2016|124 min|Biography, Drama, Sport|Mira Nair|Madina Nalwanga, David Oyelowo, Lupita Nyong'o, Martin Kabanza|USA|7.4
Quints|A 14-year-old teenager goes to desperate lengths to get attention when her mother gives birth to quints.|series|2000|83 min|Comedy, Drama, Family|Bill Corcoran|Kimberly J. Brown, Daniel Roebuck, Elizabeth Morehead, Shadia Simmons|Canada, USA|5.7
Randy Cunningham: 9th Grade Ninja|An ordinary ninth grader is chosen to become The Ninja. He is tasked with protecting the town from evil as well as balancing his school life with friends and homework.|movie|2012|15 min|Animation, Short, Action, Adventure, Comedy, Family, Fantasy, Sci-Fi|N/A|Ben Schwartz, Andrew Caldwell, John DiMaggio, Kevin Michael Richardson|UK, USA, Ireland|6.7
Ratatouille|A rat who can cook makes an unusual alliance with a young kitchen worker at a famous restaurant.|movie|2007|111 min|Animation, Adventure, Comedy, Drama, Family, Fantasy|Brad Bird, Jan Pinkava(co-director)|Patton Oswalt, Ian Holm, Lou Romano, Brian Dennehy|USA|8
Raven's Home|Though Raven Baxter is psychic, she would've never guess she'd be a single mother living in an apartment with her twins Nia and Booker Baxter and her best friend Chelsea and son Levi.|episode|2017|22 min|Comedy, Family|N/A|Raven-Symoné, Issac Ryan Brown, Jason Maybaum, Navia Ziraili Robinson|USA|7.4
Read It and Weep|A shy and retiring high school student develops a peculiar alter ego that changes her life forever.||2006|84 min|Comedy, Drama, Family|Paul Hoen|Kay Panabaker, Danielle Panabaker, Alexandra Krosney, Marquise C. Brown|USA|5.5
Ready to Run|A 14-year-old girl who works at a racetrack trains a talking racehorse with issues, transforming him into a winner.|movie|2000|96 min|Family, Sport|Duwayne Dunham|Krystle Po, Jason Dohring, Lillian Hurst, Jon Brazier|USA, New Zealand|5.3
Recess|Comic tales of a group of good friends, four boys and two girls, during breaks in primary school, as they grow up, relate to each other, and have brushes with authority.|movie|1997|23 min|Animation, Adventure, Comedy, Family|N/A|Rickey D'Shon Collins, Jason Davis, Ashley Johnson, Pamela Adlon|USA|7.8
